{
  "$schema": "https://json-schema.org/draft/2020-12/schema",
  "$id": "https://codecks.dev/schemas/autonomous-maturity-m11-dex-proxy-v1.schema.json",
  "title": "Codecks M11 emulator-only DeX proxy receipt",
  "type": "object",
  "additionalProperties": false,
  "required": ["schema", "milestone", "status", "scope", "artifacts", "profiles", "external", "limitations", "managedExecution"],
  "properties": {
    "schema": {"const": "codecks.autonomous-maturity.m11-dex-proxy.v1"},
    "milestone": {"const": "M11"},
    "status": {"enum": ["PASS", "FAIL", "NOT_RUN"]},
    "scope": {"const": "EMULATOR_PROXY_ONLY"},
    "artifacts": {
      "type": "array",
      "minItems": 1,
      "maxItems": 2,
      "items": {
        "type": "object",
        "additionalProperties": false,
        "required": ["path", "sha256", "timestamp", "passedMethods", "failedMethods", "tests", "failures", "errors", "skipped"],
        "properties": {
          "path": {"type": "string"},
          "sha256": {"type": "string", "pattern": "^[0-9a-f]{64}$"},
          "timestamp": {"type": "string", "pattern": "^\\d{4}-\\d{2}-\\d{2}T\\d{2}:\\d{2}:\\d{2}(?:\\.\\d+)?$"},
          "passedMethods": {"type": "array", "minItems": 1, "uniqueItems": true, "items": {"enum": ["managedWindow1280x720", "managedWindow1920x1080", "freeformWindow1280x720", "freeformWindow1920x1080", "secondaryDisplay1280x720", "secondaryDisplay1920x1080"]}},
          "failedMethods": {"type": "array", "uniqueItems": true, "items": {"enum": ["managedWindow1280x720", "managedWindow1920x1080", "freeformWindow1280x720", "freeformWindow1920x1080", "secondaryDisplay1280x720", "secondaryDisplay1920x1080"]}},
          "tests": {"type": "integer", "minimum": 1, "maximum": 6},
          "failures": {"type": "integer", "minimum": 0, "maximum": 6},
          "errors": {"type": "integer", "minimum": 0, "maximum": 6},
          "skipped": {"type": "integer", "minimum": 0, "maximum": 6}
        }
      }
    },
    "profiles": {
      "type": "array",
      "minItems": 2,
      "maxItems": 2,
      "items": {
        "type": "object",
        "additionalProperties": false,
        "required": ["resolution", "status", "checks"],
        "properties": {
          "resolution": {"enum": ["1280x720", "1920x1080"]},
          "status": {"const": "PASS"},
          "checks": {
            "type": "array",
            "minItems": 3,
            "items": {"enum": ["managed_window", "actual_deck_action", "actual_trackpad_mouse_down_up", "product_support_dialog", "bounded_dialog_content", "product_app_shell_navigation", "secondary_display_presentation_proxy", "rotation", "keyboard", "focus", "window_restore", "cold_activity_restart_proxy"]},
            "uniqueItems": true
          }
        }
      }
    },
    "external": {
      "type": "array",
      "minItems": 1,
      "items": {
        "type": "object",
        "additionalProperties": false,
        "required": ["id", "status", "reason"],
        "properties": {
          "id": {"const": "samsung_dex_physical"},
          "status": {"const": "NOT_RUN"},
          "reason": {"type": "string", "minLength": 1}
        }
      }
    },
    "limitations": {"type": "array", "minItems": 3, "items": {"type": "string", "minLength": 1}, "uniqueItems": true},
    "managedExecution": {
      "type": "object", "additionalProperties": false,
      "required": ["sourceCommit", "sources", "sourceTreeSha256", "sourceDiffSha256", "result", "device", "targetApk", "testApk"],
      "properties": {
        "sourceCommit": {"type": "string", "pattern": "^[0-9a-f]{40}$"},
        "sources": {"type": "array", "minItems": 8, "maxItems": 8},
        "sourceTreeSha256": {"type": "string", "pattern": "^[0-9a-f]{64}$"},
        "sourceDiffSha256": {"type": "string", "pattern": "^[0-9a-f]{64}$"},
        "result": {"type": "object"}, "device": {"type": "object"},
        "targetApk": {"type": "object"}, "testApk": {"type": "object"}
      }
    }
  }
}
